{
  "schemaVersion": "benchmark.promoted_evidence.v1",
  "evidenceId": "evidence-fixture",
  "sourceRunId": "run-fixture",
  "suiteId": "intent-classification-v1",
  "trackId": "intent-classification",
  "contractId": "intent-classifier-worker-v1",
  "approvedAt": "2026-06-23T00:00:00.000Z",
  "approvedBy": "human-review",
  "summary": {
    "schemaVersion": "benchmark.run_summary.v1",
    "runId": "run-fixture"
  },
  "notes": [
    "Fixture only."
  ]
}
